,date,location,news title,news source(url),content summary,keywords,class_name
146,01/2018,BERLIN (AFP) ,"German government condemns car firms' diesel emissions tests on humans, monkeys",https://www.straitstimes.com/world/europe/german-government-condemns-car-firms-diesel-emissions-tests-on-humans-monkeys,"The revelation came just days after the New York Times wrote that the same organisation carried out tests on monkeys in the United States in 2014.
According to the article, the researchers locked 10 monkeys into airtight chambers and made them breathe in diesel exhausts from a VW Beetle while watching cartoons.
""These tests on monkeys or even humans are in no way ethically justified,"" said Chancellor Angela Merkel's spokesman Steffen Seibert.
The tests involving 25 human volunteers were commissioned in 2012 at a university hospital in the German city of Aachen.
The study was carried out before Volkswagen's ""dieselgate"" erupted and was not linked to diesel emissions testing or to experiments involving monkeys, it added.","tests, university, research, car, study, nitrogen, humans, experiments, german, monkeys, diesel, condemns, volkswagens, group, emissions, firms",Pest and disease outbreaks
147,11/2017,"Opened in 1881, the Natural History Museum has more than 80 million artefacts in its collection.

Some exhibits on show in Singapore had never left the museum.

They include a glass replica of an octopus, which is part of a set made for the museum in the second half of the 19th century by German father",ArtScience Museum's newest exhibition Treasures of a Natural World is here,https://www.straitstimes.com/lifestyle/arts/bone-up-on-nature,"Opened in 1881, the Natural History Museum has more than 80 million artefacts in its collection.
Other priceless items include an original copy of Natural History by the Roman author, naturalist and natural philosopher, Pliny the Elder, a foundation text about the natural world in Latin that was published in Venice in 1469.
For example, it took three days for the specialists to remove the specimen of a giant ground sloth - an extinct species - from its crate and to carefully get it ready for display.
But it was well worth the effort for Mr Jim Broughton, head of international engagement at the London museum.
""The Natural History Museum, though very large, was built for a different age and, in the 19th century, special exhibitions were not something that museums did,"" he says.","artscience, sloth, singapore, world, london, include, giant, exhibition, history, museums, species, museum, treasures, natural, newest, ground",Pest and disease outbreaks
148,10/2017,"When my then boyfriend ended our relationship, I never expected him to say it was because I was too poor.

There are many reasons he could have given for breaking up.

The spark was gone.

He was no longer attracted to me.

My habit of singing Muppet songs in the shower was indisputably weird.

Instead, he said the one thing that managed to tap into all of my long",What being financially shamed taught me about relationships,https://www.straitstimes.com/lifestyle/what-being-financially-shamed-taught-me-about-relationships,"When my then boyfriend ended our relationship, I never expected him to say it was because I was too poor.
The only time I ever felt different was when another kid would make fun of our car or ask why our living room was so ""weird"".
As Ms Alysha Jeney, a therapist in Denver, says: ""Our income, career, debt and relationship with money all come from an emotional place.""
Since my relationship with my VIP-obsessed boyfriend ended, I have taken a more value-centric approach to assessing potential new partners.
I am less interested in his net worth and more curious about his overall relationship to money and whether it is compatible with mine.","partner, shamed, kid, different, money, relationship, finances, taught, mum, felt, jeney, boyfriend, financially, relationships",Pest and disease outbreaks
149,10/2017,Citronella needs well,Roots awakening,https://www.straitstimes.com/lifestyle/home-design/roots-awakening,"Joe HioaThe Mosquito Plant (Pelargonium ""Citrosum"") is not an easy plant to grow as it prefers a cooler and drier climate.
Overly wet soil often causes the lower leaves of the plant to become infected and die.
The media that is commonly used to grow this plant is often cocopeat-based, which retains too much water.
Compost a source of food for millipedesIn the past month, my garden has been infested by millipedes.
There are chemical pesticides you can use to kill them, but they may be harmful to plants and soil.","compost, plants, straits, soil, millipedes, southern, grow, leaves, plant, source, times, media",Pest and disease outbreaks
150,10/2017,Rubber ,Halcyon Agri seeks to 'reboot' rubber industry,https://www.straitstimes.com/business/companies-markets/halcyon-agri-seeks-to-reboot-rubber-industry,"The chief executive officer of Singapore-listed Halcyon Agri Corporation grew up with rubber factories as his playground.
This was followed by the purchase of rubber factories in Indonesia between late 2010 and early 2011, all of which culminated in the founding of Halcyon Agri.
AGGREGATING THE INDUSTRYMr Meyer has made it his mission to ""reboot"" the natural rubber industry.
To be the ""Wilmar of rubber"", where Halcyon is the go-to enterprise globally for natural rubber, Mr Meyer said, referring to Singapore-listed Wilmar International, the world's largest palm oil trader.
And in line with a love for rubber, Mr Meyer is fascinated with cars.","reboot, meyer, global, rubber, agri, singapore, malaysia, halcyon, mr, seeks, industry, million, natural, assets",Pest and disease outbreaks
151,10/2017,"Details on its expansion are being finalised and will be announced later, Mindef added.

The floating platform ",Floating platform to be renamed NS Square,https://www.straitstimes.com/singapore/floating-platform-to-be-renamed-ns-square,"Built initially as a temporary NDP venue while the new National Stadium was under construction, the floating platform can seat 27,000 spectators.
It was attended by 1,500 guests, including operationally ready national servicemen (NSmen), full-time national servicemen (NSFs), employers and Cabinet ministers such as Deputy Prime Minister Teo Chee Hean, Defence Minister Ng Eng Hen and Home Affairs and Law Minister K. Shanmugam.
PM Lee, in his speech, paid tribute to servicemen and dwelt on the importance of NS in keeping Singapore safe.
National servicemen told The Straits Times that the symbolic gesture of renaming the floating platform, a landmark in the heart of the city, would cement the importance of NS in the minds of Singaporeans.
Deputy Superintendent (NS) Mohammed Nazly Mohammed Taha said: ""It will motivate our younger generation to think about what NS means to them.""","national, safe, ns, square, singapore, servicemen, floating, renamed, scdf, platform, saf, singaporeans, defence",Pest and disease outbreaks
152,11/2017,WASHINGTON (THE WASHINGTON POST) ,Eating bugs can help the environment. But will people eat them?,https://www.straitstimes.com/lifestyle/food/eating-bugs-can-help-the-environment-but-will-people-eat-them,"Most of us (me included) have a sense that eating insects is kind of disgusting.
Of eating insects, she says, ""There's been a taboo since about 500 B.C.
One is San Francisco-based Chirps Chips, co-founded by Laura D'Asaro and Rose Wang, who set out to normalize insect eating.
And, once the cool kids are eating cricket chips, well .
So if you do not want to eat insects, do not eat insects!","eat, food, insect, eating, environment, bugs, flour, insects, chips, cricket, help, protein, think",Pest and disease outbreaks
153,11/2017,"She was born in the jungles of Ipoh during the Japanese Occupation, surrounded by the greenery of the rainforest.

Today, the circumstances could not be more different, but Ms Kok Oi Yee still goes out into the jungles. This time, as a nature guide.

""Anything I don't know about, I want to learn,"" said the sprightly 75",The Lives They Live: Undying love for nature drives this 75-year-old guide,https://www.straitstimes.com/singapore/undying-love-for-nature-drives-this-75-year-old-guide,"She was born in the jungles of Ipoh during the Japanese Occupation, surrounded by the greenery of the rainforest.
Today, the circumstances could not be more different, but Ms Kok Oi Yee still goes out into the jungles.
Despite having a place at Raffles Girls' School, Ms Kok was told by her mother then that she had to work to support their family.
In 1960, when she was 18, she joined the zoology department of the National University of Singapore (NUS), then called the University of Malaya in Singapore, as an assistant lab technician.
""My biology knowledge was only up till O levels,"" said Ms Kok.","lives, live, 75yearold, ms, drives, university, kok, singapore, guide, school, levels, yee, zoology, jungles, work, nature, undying, love",Pest and disease outbreaks
154,11/2017,"In a Facebook post last week, he took note of the recent works of professors Chua Beng Huat and Cherian George, academics whose unflinching gaze makes some on this island uncomfortable, framing them as ""two critical lovers of Singapore"". He then lent them additional air cover by calling them ""brilliant scholars and friends"". Clearly, he believes that while cynicism is a waste, a critical outlook is healthy for society's progress. This is one lesson from the ""Prof"" that must be heeded by anyone who has accumulated vast power, including those running governments in Tokyo, Beijing or New Delhi.

It is always tempting to ponder what might have been if such a man as this, with his egalitarian and inclusive instincts, tolerance of dissent, love of cultures and pan","Singapore's Tommy Koh, Asia's professor",https://www.straitstimes.com/opinion/singapores-tommy-koh-asias-professor,"Scholar-statesman George Yeo, Singapore's former foreign minister, says that as a Cambridge undergraduate in the 1970s he had heard rumours that Prof Koh might be a potential prime minister.
Prof Koh chose not to bid for that responsibility, apparently for family reasons.
As Singapore's permanent representative to the UN, Prof Koh was a big voice in campaigning for democratic Kampuchea and attacking the Soviet occupation of Afghanistan the following year.
Prof Koh, chairing the session featuring Mr Rudd, popped three questions to poll the CEOs present.
For the rest of us in Singapore, Asean and wider Asia, it is: Seize the day!","asean, asias, singapore, foreign, singapores, secretarygeneral, prof, professor, prime, minister, tommy, question, koh, rudd",Pest and disease outbreaks
155,08/2017,"It is a life force of about 60 million people, who depend on it for food, trade and transport. In Laos itself, the river flows 1,600km across the country, from north to south.

Along the banks of the river and its tributaries, indigenous tribes, living much as they have done for centuries, grow rice and harvest the fish",Down the mighty Mekong,https://www.straitstimes.com/lifestyle/travel/down-the-mighty-mekong,"FEROCIOUS UPPER MEKONGEarly in our journey, we witness how ferocious the upper Mekong can be, making it one of the world's trickiest rivers to navigate.
But our veteran Laotian captain Houm Phan and his first mate Boun guide the flat-bottomed Laos Pandaw effortlessly into clear passageways.
MORE DRAMA, MORE TRANQUILLITYFrom Luang Prabang, the Mekong swings southwards to flow some 400km before meeting the border with Thailand again.
What makes the Laos Pandaw special is that she has strong links to the Mekong.
The Laos Pandaw cruises the Mekong every year from September to April.","mighty, river, boat, luang, cruises, upper, thailand, deck, pandaw, mekong, laos",Pest and disease outbreaks
156,09/2017,"Plants too close to each another

A few months ago, I planted Jatropha integerrima and Murraya paniculata plants next to each other. I pruned them regularly to encourage denser growth. I noticed the Jatropha integerrima grows faster and taller than the Murraya paniculata. Are there any advantages to growing different species of plants side by side?

Sheena Goh

From your pictures, the plants may be planted too close to each other. Your Jatropha integerrima plants are blocking sunlight from your Murraya paniculata plants.

As your plants are grown in a sheltered area where sunlight comes from only one direction, move the planter box so that the plants are exposed to the maximum amount of sunlight. Space them out well so that they do not block each other.

Different plants have varying growth rates. Some gardeners like to grow a range of plants together mainly for aesthetic reasons.

A mixture of plants can provide a visually attractive contrast of leaf textures, colours and growth forms. However, this needs to be done carefully, taking into account each plant's growth rates and requirements. Competition can do more harm than good.

However, companion planting may help to deter certain pests from particular plants.

Hand",Root Awakening,https://www.straitstimes.com/lifestyle/home-design/root-awakening-26,"However, this needs to be done carefully, taking into account each plant's growth rates and requirements.
Hand-pollinate soursop plant to encourage fruit growthI bought a small soursop tree from a nursery about five years ago and planted it in my garden.
Soursop flowers are different from typical flowers - the stigma of each flower is not receptive until after the pollen has been shed.
Beetles are known to pollinate soursop flowers.
Henri TanThe probable reason for the burnt leaf edges could be a lack of calcium for plant growth.","sunlight, soursop, plants, fruit, straits, flowers, lack, tree, growth, water, plant, times",Pest and disease outbreaks
157,09/2017,"It has been a while since a station wagon graced the cover of Torque. Then again, the Porsche Panamera Sport Turismo is no ordinary wagon.

Its fanciful name aside, the practical performer has uncommon credentials, such as a 550bhp/770Nm engine in the Turbo variant. Clocking a 3.6",Station wagon extraordinaire,https://www.straitstimes.com/lifestyle/station-wagon-extraordinaire,"It has been a while since a station wagon graced the cover of Torque.
Then again, the Porsche Panamera Sport Turismo is no ordinary wagon.
Its fanciful name aside, the practical performer has uncommon credentials, such as a 550bhp/770Nm engine in the Turbo variant.
September's issue also looks at two very different convertibles - the Mini Cooper S Convertible and the Range Rover Evoque Convertible.
Other topless cars include the new Volkswagen Beetle Cabriolet and its predecessor, and the Mazda MX-5 RF and its predecessor.","volkswagen, wagon, turismo, uncommon, torques, torque, station, turbo, topless, extraordinaire, wagonits, variant",Pest and disease outbreaks
158,09/2017,LONDON • Everton forward Wayne Rooney has been arrested on suspicion of drink,British police charge Rooney for drink-driving,https://www.straitstimes.com/sport/football/british-police-charge-rooney-for-drink-driving,"LONDON • Everton forward Wayne Rooney has been arrested on suspicion of drink-driving, the BBC and Sky Sports reported yesterday.
A source told Metro that Rooney was spotted dancing on the tables at Bubble Room and singing a rendition of Wonderwall with Burnley player Phil Bardsley's brother.
Another source told Mail Online that Rooney's former Manchester United team-mate Wes Brown was also spotted at the bar.
Rooney announced his retirement from international football last week, having scored 53 goals in 119 appearances for his country.
Rooney rejoined boyhood club Everton in the pre-season from Premier League rivals United and has been fairly successful thus far.","manchester, league, source, spotted, scored, british, drinkdriving, charge, told, stopped, yesterday, united, rooney",Pest and disease outbreaks
159,09/2017,"NEW YORK • Who would give the time of day to a 1968 Rolex Daytona once owned by actor Paul Newman?

Maybe not the cellphone",Paul Newman's rare Rolex surfaces to go under the hammer,https://www.straitstimes.com/lifestyle/paul-newmans-rare-rolex-surfaces-to-go-under-the-hammer,"NEW YORK • Who would give the time of day to a 1968 Rolex Daytona once owned by actor Paul Newman?
But to the swelling legions of watch geeks worldwide, who think of vintage timepieces as fine art, a Paul Newman Daytona is the one watch that seemingly every selfrespecting collector needs to own.
It is coveted all the more because for decades, no one outside the Newman family seemed to know where it was.
Mr Andrew Shear, a prominent New York vintage watch dealer, said: ""I could see it selling for US$10 million (S$13.6 million).""
Mr Cox's first inkling that his watch was valuable came at a trade show in 1993, when a Japanese man approached him and excitedly blurted out, ""Paul Newman watch"".","watch, daytona, cox, rolex, surfaces, newmans, hammer, paul, family, rare, york, actor, newman, vintage",Pest and disease outbreaks
160,09/2017,LONDON • Wayne Rooney will find a livid Ronald Koeman waiting for him when he reports back at Everton today after being charged with drink,Rooney drives wife Coleen and manager to despair,https://www.straitstimes.com/sport/football/rooney-drives-wife-coleen-and-manager-to-despair,"On Saturday, probing tabloids cascaded Rooney's arrest into a real-life drama by also involving his pregnant wife Coleen and brunette office worker Laura Simpson.
Rooney had been driving Simpson's black soft-top Volkswagen Beetle - while she was a passenger - when he was pulled over.
The 31-year-old was said by the Sun to be ""livid and embarrassed"", adding that Coleen went ""berserk"" after hearing the news.
She told the Daily Mail: ""I'm a single girl and I'm allowed to have some fun.
Rooney is likely to be fined heavily by Everton today and be given further blunt reminders by Koeman about his behaviour.","mail, drives, despair, wife, daily, manager, rooneys, everton, away, told, koeman, coleen, night, rooney",Pest and disease outbreaks
161,09/2017,When I stepped off the S,A pilgrimage to Stuttgart,https://www.straitstimes.com/lifestyle/a-pilgrimage-to-stuttgart,"Stuttgart is home to these two luxury brands and as a car guy and motoring journalist, I have always wanted to make the pilgrimage there.
But since the companies' founders got their 19th-century starts in Stuttgart, it comes closest.
I also knew that Stuttgart was a must-see for Porschephiles.
The building provides a floor-by- floor circular walk through Mercedes history over its nine floors and 177,000 sq ft of exhibition space, with the timeline starting on the top floor.
There is no such problem at the Porsche Museum, about 11km away from Mercedes.","car, carriage, mercedes, history, founder, museum, pilgrimage, porsche, stuttgart, engines, cars",Pest and disease outbreaks
162,09/2017,(GUARDIAN) ,Football: Everton forward Wayne Rooney pleads guilty to drink driving offence,https://www.straitstimes.com/sport/football/football-everton-forward-wayne-rooney-pleads-guilty-to-drink-driving-offence,"(GUARDIAN) - Former England football captain Wayne Rooney pleaded guilty to a drink driving charge on Monday (Sept 18) and was banned from driving for two years, and ordered to perform 100 hours of community service.
""Following today's court hearing, I want publicly to apologise for my unforgivable lack of judgement in driving while over the legal limit.
""I have already said sorry to my family, my manager and chairman and everyone at Everton FC.
Now I want to apologise to all the fans and everyone else who has followed and supported me throughout my career.
""Of course I accept the sentence of the court and hope that I can make some amends through my community service.""","forward, unforgivable, statementi, supported, everton, guilty, drink, todays, pleads, community, court, wrong, receives, wayne, football, driving, apologise, rooney",Pest and disease outbreaks
163,09/2017,(NYTimes) ,Artists blast Guggenheim for pulling works involving animals from China show,https://www.straitstimes.com/lifestyle/arts/artists-blast-guggenheim-for-pulling-works-involving-animals-from-china-show,"The three works in the Guggenheim show, which opens on Oct 6, were created between 1993 and 2003 and were intended to symbolically depict oppression in China.
They objected to a white artist's using - and potentially profiting from - an image of violence against a black person and urged that the painting not only be removed from the show but also destroyed.
""It's the right thing to do,"" said Stephen F. Eisenman, an art history professor at Northwestern University who has written extensively about the ethics of using animals in art.
""China has no laws protecting animals, so withdrawing these pieces may help the country and its artists recognise that animals are not props and that they deserve respect,"" she said.
But Sarah Cohen, an art historian at the University at Albany whose research focuses on artistic representations of animals, questioned why the Guggenheim included the works at all.","involving, art, works, guggenheims, pulling, using, guggenheim, china, museums, museum, blast, artwork, animals, artists",Pest and disease outbreaks
164,09/2017,NEW YORK • Artists and museums are often in the thick of free speech debates ,Guggenheim blasted for pulling animal artworks,https://www.straitstimes.com/lifestyle/arts/guggenheim-blasted-for-pulling-animal-artworks,"Typically the art world holds its ground.
The Walker Art Centre recently moved to dismantle Sam Durant's sculpture Scaffold - a representation of seven gallows used in historic United States government executions - in response to protests.
""Pressuring museums to pull down artwork shows a narrow understanding about not only animal rights, but also human rights.""
Protesters marched outside the museum over the weekend and an online petition demanded ""cruelty-free exhibits"" at the Guggenheim.
But Dr Sarah Cohen, an art historian at the University at Albany, questioned why the Guggenheim included the works at all.","blasted, art, works, world, pulling, shows, guggenheim, york, artworks, museums, museum, walker, animals, animal",Pest and disease outbreaks
165,07/2017,"When summer ends and skies fade to grey, foodies have something to look forward to as truffles arrive with autumn.

They may look like lumpy, dirty potatoes, but the scent of fresh truffles can elevate any dish.

And every year, the world's top chefs and food buyers flock to Alba, a city in the Piedmont region of northern Italy, to buy the world's best truffles at the International Alba White Truffle Fair.

Unlike black truffles, no cultivation technique has been developed for the white variety, which is rarer and grows only in the wild.

One must forage in the woods, where they grow symbiotically with oak, hazel, poplar and beech trees.

Though white truffles can also be found in certain parts of France, Croatia and Slovenia, they grow particularly well in the countryside around the Piedmontese cities of Alba and Asti, where truffle hunters dig for them from late September to December every year.

The fair is an opportunity for the hunters to showcase and sell their white treasures, which fetch prices anywhere from €50 (S$79) to tens of thousands of euros apiece.

Thousands of food",Eat your way around the world's best food festivals,https://www.straitstimes.com/lifestyle/travel/eat-your-way-around-the-world,"When summer ends and skies fade to grey, foodies have something to look forward to as truffles arrive with autumn.
And every year, the world's top chefs and food buyers flock to Alba, a city in the Piedmont region of northern Italy, to buy the world's best truffles at the International Alba White Truffle Fair.
Thousands of food-lovers attend the festival and truffles bought here are flown to restaurants all over the world.
The Alba Truffle Show - featuring talks, cooking demonstrations, book presentations and workshops with celebrity chefs - is held every weekend during the fair.
Ms May Lee, who was at the truffle festival last year, says: ""There were lots of people there, but in a very Italian, laidback way.","eat, truffle, white, food, truffles, festival, alba, menu, piedmont, best, way, market, worlds, festivals",Pest and disease outbreaks
166,08/2017,"Foreign objects can become stuck in various parts of the body, such as the ear and nose. Here are some tips on what you can do to prevent this from happening and how to get rid of them safely.

BUTTON BATTERIES: KEEP THEM AWAY FROM CHILDREN

Always buy toys that have the battery compartment secured with screws to lower the chance of a child obtaining the button battery, said Dr Dennis Chua, a consultant otolaryngologist (ENT) from Mount Elizabeth Hospital.

A button battery stuck in the nose is an emergency that needs immediate attention because it can burn through the nose in 15 minutes, depending on the amount of moisture in the nose and whether it is a fresh battery, he said.

""A button battery generates a localised chemical reaction that results in injuries to the surrounding tissue.""

Warning signs include a one","Doc, there's a UFO in my ear",https://www.straitstimes.com/singapore/doc-theres-a-ufo-in-my-ear,"""A button battery generates a localised chemical reaction that results in injuries to the surrounding tissue.""
Olive oil will not harm you as it is commonly used to soften very hard ear wax to make it easier to flush out.
If you do not have olive oil at home, use any type of clean cooking oil, Dr Tan said.
If the doctor cannot remove it, he will refer the patient to the emergency department at a hospital, he said.
The ears are self-cleaning and ear wax is meant to protect your ear canal skin and kill germs.","nose, dr, emergency, ear, ufo, theres, doc, battery, oil, insects, department, wax, button",Pest and disease outbreaks
