,date,location,news title,news source(url),content summary,keywords,class_name
83,08/2020,New Mercedes,Fast Lane,https://www.straitstimes.com/lifestyle/motoring/fast-lane-76,"Engine choices are likely to include a 2-litre petrol turbo with 197hp and 320Nm, and a 3-litre straight-six petrol with 367hp and 500Nm.
Pay for parking with electricityNissan is giving customers yet another reason to love their electric cars: the ability to pay for parking with electricity.
Bentley Motors' plan for sustainable luxury mobilityBentley Motors is embarking on a three-year study which promises to transform electric vehicle powertrains.
This reinforces Bentley's ambition to lead sustainable luxury mobility and introduce the first fully electric Bentley by 2026.
The study follows an initial 18-month investigation that delivered a technological breakthrough in electric drive systems for high-performance vehicles.","vehicle, pay, sustainable, study, straits, luxury, electric, system, pavilion, petrol, times, parking",Pest and disease outbreaks
84,06/2020,"How do you sail a tiny boat through massive swells when there is a raging electrical storm, the rudder in the vessel isn't responding promptly enough to the steering, the familiar lighthouses along the coast have vanished from view and your GPS settings seem to have gone haywire unexpectedly?

That's the kind of external situation Singapore, the little red cork bobbing on the channel connecting the South China Sea and the Indian Ocean, is facing as it goes into an election in times such as it has never seen before.

Prime Minister Lee Hsien Loong referred to it this week when he announced the July 10 parliamentary polls, pointing to a troubled landscape that includes tense United States",Singapore GE2020: Navigating choppy waters amid shifting geopolitical tides,https://www.straitstimes.com/singapore/navigating-choppy-waters-amid-shifting-geopolitical-tides,"As he put it, ""we do not know what surprises lie in store for us within the next year"".
This has now been crowned by the frightening pandemic that has claimed nearly half a million lives worldwide and cratered already-slowing Asian economies.
Worse, has actively worked to disrupt it, for instance by threatening trade pacts, bringing the World Trade Organisation close to paralysis and, most recently, announcing a withdrawal from the United Nations World Health Organisation?
Meanwhile, a new Sun has entered the solar system in the shape of China, increasingly unabashed about its size and strength.
It is like an Asian elephant that's discovered its true size vis-a-vis the stick-wielding mahout that gave it orders, and now demands the run of the forest.","nations, shifting, singapore, ge2020, trade, election, china, navigating, waters, world, constellation, asian, mr, amid, trump, geopolitical, choppy, tides, united",Pest and disease outbreaks
85,06/2020,SINGAPORE ,Rare sighting of large colony of flying foxes in Singapore on World Environment Day,https://www.straitstimes.com/singapore/environment/rare-sighting-of-large-colony-of-flying-foxes-in-singapore-on-world,"SINGAPORE - World Environment Day is celebrated on June 5 every year, and Singapore marked the occasion last Friday (June 5) with a rare sighting: a colony of large flying foxes soaring over the Central Catchment Nature Reserve.
The last time these bats were seen in Singapore was more than four years ago, with six sighted in the MacRitchie area in May 2016.
Ms Jabbar said the sighting on World Environment Day was a great surprise.
Dr Lee said the large flying fox is native to Singapore.
They are migratory animals, which means they have a large home range and move frequently across international borders.","range, lee, colony, foxes, singapore, day, world, environment, rare, sighting, travel, sight, flying, large, nature",Pest and disease outbreaks
86,06/2020,"World Environment Day, which falls on June 5 every year, was made more memorable in Singapore with a rare sighting last Friday: a colony of over 100 large flying foxes soaring over the Central Catchment Nature Reserve.

The last time such bats were seen in Singapore was more than four years ago, when six were sighted in the MacRitchie area in May 2016.

Dr Benjamin Lee, director of wildlife management research at the National Parks Board (NParks), said: ""This sighting of more than 100 individuals is unprecedented in Singapore in recent times.""

Primate researcher Sabrina Jabbar caught sight of the bats while exercising in the nature reserve at about 7.30am last Friday, and captured the encounter in photographs and videos.

Ms Jabbar said the sighting on World Environment Day was a great surprise. ""It was such a magnificent sight against the backdrop of the cloudy sky,"" she added.

Dr Lee said the large flying fox, a fruit bat, is native to Singapore.

They are migratory animals, which means they have a large home range and move frequently across international borders.

They have been known to travel several hundreds of kilometres between roosting sites, and their home range includes southern Peninsular Malaysia, Singapore and Sumatra in Indonesia, said Dr Lee.

""It is not unusual for flying foxes to travel in large groups when they are in search of food or due to disturbances to their camps such as habitat destruction or sustained hunting,"" he added.

Ms Jabbar said that while it was nice to see the flying fox in such large numbers, the animals may have been forced to move due to threats faced elsewhere, such as habitat loss. ""I hope they have found a safe place to settle,"" she said.

The large flying fox is one of 28 species of bats in Singapore",100 large flying foxes spotted on World Environment Day,https://www.straitstimes.com/singapore/environment/100-large-flying-foxes-spotted-on-world-environment-day,"World Environment Day, which falls on June 5 every year, was made more memorable in Singapore with a rare sighting last Friday: a colony of over 100 large flying foxes soaring over the Central Catchment Nature Reserve.
Ms Jabbar said the sighting on World Environment Day was a great surprise.
Dr Lee said the large flying fox, a fruit bat, is native to Singapore.
Ms Jabbar said that while it was nice to see the flying fox in such large numbers, the animals may have been forced to move due to threats faced elsewhere, such as habitat loss.
The large flying fox is one of 28 species of bats in Singapore.","jabbar, foxes, day, singapore, world, 100, spotted, bats, environment, sighting, travel, sight, flying, fox, large",Pest and disease outbreaks
87,06/2020,MOSCOW (AFP) ,"Climate change brings fires, floods and moths to Siberia",https://www.straitstimes.com/world/europe/climate-change-brings-fires-floods-and-moths-to-siberia,"MOSCOW (AFP) - Best known as a vast, cold tundra, Russia's sprawling Siberia region is being transformed by climate change that has brought with it warmer temperatures, forest fires and growing swarms of hungry moth larvae.
Then spring came, and with it much warmer temperatures.
The warmer temperatures didn't just bring wild flowers and boosted ice cream sales.
The moths are usually inactive during winter and eat in spring, summer and autumn periods which are now lengthening.
The larvae, which are taking over larger areas of forest, strip trees of their needles and make them more susceptible to forest fires.","weather, wild, brings, moth, warmer, siberia, forest, winter, temperatures, change, fires, moths, trees, climate, floods, spring",Pest and disease outbreaks
88,05/2020,"While I agree with Mr Christiaan Starke that exposure to animals will encourage a better understanding of them, that exposure does not come only from having pets (Opening up pet industry would widen horizons, May 22).

Like Mr Starke, I was exposed to many animals in my childhood. But for me, the animals were in their natural habitat, instead of in captivity. I found the teamwork of industrious ants, agility of lizards catching their prey and the intelligence of birds to be captivating.

Children's interests are easily piqued and it pays to introduce them to nature early so that they learn not to ""react with fear or disgust when faced with animals that are not commonly seen"", as Mr Starke put it.

The exposure can be done in gardens and parks, instead of staring at captive pets in tanks or terrariums at home. Being outdoors brings additional health benefits and Singapore's lack of seasons makes going outdoors possible all year round.

There is no lack of variety in Singapore's fauna either. For example, Mr Starke's interest in beetles can be satisfied by going to accessible places such as the Dairy Farm, Lorong Halus and catchment areas to observe the many different species.

Mr Starke's call for a negative instead of a positive list of illegal pets might result in too many species being brought into Singapore. With the country's high population density, there is a high probability of conflict among residents, as one man's pet may be another man's pest.

It makes more sense to enjoy nature in the wild.

Agnes Sng Hwee Le",Forum: Better to enjoy nature in the wild,https://www.straitstimes.com/forum/forum-better-to-enjoy-nature-in-the-wild,"Like Mr Starke, I was exposed to many animals in my childhood.
The exposure can be done in gardens and parks, instead of staring at captive pets in tanks or terrariums at home.
For example, Mr Starke's interest in beetles can be satisfied by going to accessible places such as the Dairy Farm, Lorong Halus and catchment areas to observe the many different species.
Mr Starke's call for a negative instead of a positive list of illegal pets might result in too many species being brought into Singapore.
It makes more sense to enjoy nature in the wild.","wild, starke, better, singapores, instead, mr, starkes, enjoy, outdoors, pets, pet, forum, animals, nature, exposure",Pest and disease outbreaks
89,04/2020,"Leaves of Japanese menthol mint have strong and sharp flavour

I was told this plant is a mint. What is its name and are the leaves edible?

Gan Sing Hai

The plant is a cultivar of Mentha arvensis. It is sometimes called the Japanese menthol mint and, locally, some people name it ""icy mint"". The common names are due to the leaves' strong and sharp minty flavour, without the sweetness that the common spearmint has.

As such, this mint has rather limited culinary uses. Some people use the leaves to make a medicinal tea to clear the airways.

Trumpet Bush stem cuttings need time to root

What is the name of this shrub? It seems to be a freeflowering plant. What is the best and/or easiest way to propagate it? I have tried rooting cuttings, but without any success.

Leong Liew Geok

The plant is known commonly as Esperanza and Trumpet Bush. Its botanical name is Tecoma fulva ssp. guarume.

You can use semi",Root Awakening,https://www.straitstimes.com/lifestyle/home-design/root-awakening-120,"Leaves of Japanese menthol mint have strong and sharp flavourI was told this plant is a mint.
Plant may be King of BittersThis plant is growing in my garden among the aloe vera and mint.
May TeoYou may want to check the growing media.
It is highly moisture-retentive and may not dry out totally if the plant is grown in a shaded area.
Remove the coco peat growing media and change it to something that is more well-draining.","growing, straits, motherinlaws, cuttings, leaves, bugs, way, grown, mint, plant, times, media",Pest and disease outbreaks
90,02/2020,WASHINGTON (REUTERS) ,"Fireflies threatened globally, with light pollution a glaring problem",https://www.straitstimes.com/world/united-states/fireflies-threatened-globally-with-light-pollution-a-glaring-problem,"The second-leading threat was light pollution.
Fireflies flash to communicate as a part of courtship and reproduction.
""Light pollution affects lots of nocturnal creatures, but fireflies are especially susceptible to this particular threat,""said biology professor Sara Lewis of Tufts University in Massachusetts, who led the research published this week in the journal Bioscience.
Satellite data has shown nighttime light pollution from the incessant flow of electric lights expanding on a global scale.
""I know a lot of people who really hate insects, but I've never met anyone who doesn't love fireflies,"" Lewis added.","threat, globally, courtship, light, glaring, fireflies, flash, researchers, pollution, lewis, nighttime, tufts, problem, threatened",Pest and disease outbreaks
91,02/2020,"WASHINGTON • Fireflies are under threat globally, with familiar hazards such as habitat loss and pesticides compounded by another peril ",Night lights hamper firefly courtship,https://www.straitstimes.com/world/united-states/night-lights-hamper-firefly-courtship,"WASHINGTON • Fireflies are under threat globally, with familiar hazards such as habitat loss and pesticides compounded by another peril - humanity's ubiquitous night-time artificial light which plays havoc with their balletic nocturnal courtship, scientists said.
The second-leading threat was light pollution.
Fireflies flash to communicate as a part of courtship and reproduction.
""That's because many - though not all - fireflies rely on bioluminescent courtship signals to find their mates.
Satellite data has shown night-time light pollution from the incessant flow of electric lights expanding on a global scale.","threat, courtship, light, nocturnal, hamper, fireflies, pesticides, signals, firefly, lights, pollution, nighttime, researchers, night",Pest and disease outbreaks
92,12/2019,JERUSALEM (AFP) ,Israeli museum explains the emojis of ancient Egypt,https://www.straitstimes.com/lifestyle/arts/israeli-museum-explains-the-emojis-of-ancient-egypt,"JERUSALEM (AFP) - How does an academic explain the importance of ancient hieroglyphics to modern audiences glued to their phones?
The Israel Museum in Jerusalem last week opened the Emoglyphs exhibition, comparing the pictograms of antiquity to those of today.
""I usually find it very hard to explain how hieroglyphs are used as a script,"" the show's curator, Ms Shirly Ben-Dor Evian, said.
The exhibition, in a small gallery within the Israel Museum, welcomes visitors with a wall bearing similar pictograms from both eras.
""There is a similarity in design and shapes, which is very interesting because there are thousands of years and very big cultural gaps between those two systems,"" Ms Ben-Dor Evian said.","jerusalem, ms, egypt, israel, similar, museum, emojis, pictograms, ancient, bendor, israeli, word, evian, modern, explains",Pest and disease outbreaks
93,12/2019,"A lot can happen in a year. So, just how well do you remember 2019?

With just days to go before welcoming 2020 ",From #10YearChallenge to rare 'ring of fire' eclipse: How the Internet remembers 2019,https://www.straitstimes.com/singapore/from-10yearchallenge-to-rare-ring-of-fire-eclipse-how-the-internet-remembers-2019,"With just days to go before welcoming 2020 - and a new decade, gasp!
- The Straits Times looks back on the stories and videos that got readers talking online.
Here are 10 stories, videos and posts that fired the Internet in 2019.
#10YearChallengeThe viral #10YearChallenge took the world by storm in January, with people sharing a current photo of themselves and one from 2009.
In Singapore, social media users, politicians and celebrities were quick to join in the buzz with their creative posts on Facebook and Instagram.","videos, fired, viral, world, 2019, users, eclipse, rare, ring, internet, posts, took, welcoming, talking, days, times, 10yearchallenge",Pest and disease outbreaks
94,11/2019,SINGAPORE ,Lighting up Pasir Ris Park with more fireflies,https://www.straitstimes.com/singapore/lighting-up-pasir-ris-park-with-more-fireflies,"SINGAPORE - Strolling in Pasir Ris Park will soon be a much brighter affair thanks to a programme to increase the firefly population in the area.
Pasir Ris Park's mangrove habitat, which has not been disturbed for over 50 years, is the only place in Singapore where the public can get reasonably close to fireflies.
Panasonic's staff will be trained to conduct regular firefly population surveys to monitor the effectiveness of these measures.
Educational signboards on the firefly population, their habitat and ongoing conservation efforts will also be set up.
The mangrove area is home to at least two firefly species - the locally endangered Pteroptyx valida and the Pteroptyx malaccae.","singapore, fireflies, parks, firefly, pasir, mangrove, lighting, ris, park, population, habitat, species, pteroptyx, programme",Pest and disease outbreaks
95,11/2019,"$20k boost for scheme to raise firefly numbers

Technology giant Panasonic has contributed $20,000 to a National Parks Board initiative that aims to boost the number of fireflies at Pasir Ris Park as part of a strategy to conserve mangrove forests.

The presence of fireflies, which are not commonly sighted and are highly sensitive to changes in the environment, is indicative of a healthy mangrove.

The new scheme involves reducing light pollution by using wildlife",Home Briefs: $20k boost for scheme to raise firefly numbers,https://www.straitstimes.com/singapore/home-briefs-20k-boost-for-scheme-to-raise-firefly-numbers,"$20k boost for scheme to raise firefly numbersTechnology giant Panasonic has contributed $20,000 to a National Parks Board initiative that aims to boost the number of fireflies at Pasir Ris Park as part of a strategy to conserve mangrove forests.
The presence of fireflies, which are not commonly sighted and are highly sensitive to changes in the environment, is indicative of a healthy mangrove.
The new scheme involves reducing light pollution by using wildlife-friendly lights along the mangrove zone.
Mangrove trees will also be planted to provide a conducive habitat for these soft-bodied beetles.
""Preliminary investigations revealed that an LTA official had spotted a vehicle suspected of displaying a false licence plate on his car along Geylang Bahru Road.","taxi, resident, car, bmw, raise, briefs, 20k, suspected, driver, road, firefly, scheme, numbers, boost, mangrove, plate",Pest and disease outbreaks
96,09/2019,"BRAUNSCHWEIG, GERMANY (AFP) ",Volkswagen faces first mammoth diesel lawsuit on home turf,https://www.straitstimes.com/world/europe/volkswagen-faces-first-mammoth-diesel-lawsuit-on-home-turf,"BRAUNSCHWEIG, GERMANY (AFP) - Car behemoth Volkswagen (VW) will face a German court on Monday (Sept 30), as hundreds of thousands of owners of manipulated diesel cars demand compensation four years after the country's largest post-war industrial scandal erupted.
Around 450,000 people have joined a first-of-its-kind grouped proceeding, introduced by lawmakers after the ""dieselgate"" emissions cheating scandal broke in 2015.
50 Questions For JudgesIn the mass lawsuit, the most important of around 50 questions for judges is whether Volkswagen ""caused harm"" by acting ""dishonestly"".
Mr Klaus Mueller of VZBV said he is ""convinced"" the car firm did, while VW says ""clients did not suffer harm"".
""Hundreds of thousands of cars are used"" on the roads without problem, VW lawyer Martine de Lind van Wijngaarden said.","vw, volkswagen, turf, largest, diesel, faces, mammoth, questions, trial, judges, scandal, lawsuit, thousands, plaintiffs, vzbv",Pest and disease outbreaks
97,09/2019,"A limo goes electric

Electric cars are not confined to compacts. Mercedes",Fast Lane: A limo goes electric,https://www.straitstimes.com/lifestyle/motoring/fast-lane-a-limo-goes-electric,"With electric motors at the front and rear axles, it is an all-wheel-drive, with variable torque distribution.
Big and strong Audi RS7 SportbackThe new Audi RS7 Sportback is a wide-bodied five-seater with stupendous performance as well as efficiency through a mild hybrid system.
Beetle goes electricThe Beetle may have been discontinued, but Volkswagen Group Components will supply electric drive systems to convert the original Beetle into an emission-free classic.
Volkswagen's electric car almost as affordable as GolfVolkswagen's long anticipated ID3 electric car is priced below €30,000 (S$45,500), making it slightly costlier than the VW Golf.
The front-wheel-drive hybrid system uses a 180hp three-cylinder 1.5-litre petrol engine coupled with an 82hp electric motor to achieve a combined output of 262hp, making it the most powerful XC40 (above).","range, fast, car, lane, petrol, motor, 100kmh, limo, hybrid, electric, system, seconds, torque, goes",Pest and disease outbreaks
98,08/2019,"Around half the world in 92 days

The Automobile Association of Singapore's 92",Fast Lane: Around half the world in 92 days,https://www.straitstimes.com/lifestyle/motoring/fast-lane-around-half-the-world-in-92-days,"Around half the world in 92 daysThe Automobile Association of Singapore's 92-day London-to-Singapore driving odyssey is under way.
The convoy of 16 cars and 31 participants left London on Aug 10 for the longest expedition the AAS has organised.
Bentley recreates long-lost 1939 CornicheVolkswagen-owned Bentley Motor Cars has revived the Corniche.
The recreated Corniche will debut at Salon Prive next month, followed by a world tour.
Audi says the rider has one hand free to give hand signals to others on the pavement.","half, troc, ioniq, bentley, fast, lane, corniche, world, mini, 92, hand, motor, audi, cars, days",Pest and disease outbreaks
99,08/2019,NEW YORK (NEW YORK TIMES) ,'Is he really saying 30 or 13 million?': Sotheby's auction blunder sputters sale of Nazi-era Porsche,https://www.straitstimes.com/world/united-states/is-he-really-saying-30-or-13-million-sothebys-auction-blunder-sputters-sale-of,"362, the much-heralded Porsche Type 64, a swooping Nazi-era roadster that was built by automaker Ferdinand Porsche nine years before he founded his car company.
That would have been substantially higher than the record US$48.4 million a 1962 Ferrari 250 GTO fetched last year at another Sotheby's auction.
Chris Harris of the British series ""Top Gear"" fawned over the Porsche Type 64 during a recent test drive.
Lee said he had difficulty understanding the Sotheby's auctioneer all weekend.
RM Sotheby's was still advertising the car on its auction website.","auctioneer, saying, blunder, car, really, naziera, type, high, price, sputters, auction, rm, porsche, million, sale, sothebys",Pest and disease outbreaks
100,08/2019,FRANKFURT (REUTERS) ,"Ferdinand Piech, architect of Volkswagen's global expansion, dies aged 82",https://www.straitstimes.com/world/europe/ferdinand-piech-architect-of-volkswagens-global-expansion-dies-aged-82,"FRANKFURT (REUTERS) - Ferdinand Karl Piech, Volkswagen AG's former chairman and chief executive, who transformed the German company from a struggling midsized carmaker into a global automotive powerhouse, has died, his wife said in a statement.
Piech, 82, who had 13 children by four different women, died suddenly on Sunday (Aug 25), his wife Ursula said.
""The life of Ferdinand Piech was shaped by his passion for automobiles and for the employees that create them.
Business and politics never distracted me from the core of our mission: to develop and make attractive cars,"" Piech wrote in his autobiography.
""I remember Ferdinand Piech as a great manager and engineer,"" Volkswagen's labour chief Bernd Osterloh said on Tuesday.","piech, vw, global, chief, volkswagen, 82, billion, piechs, volkswagens, expansion, architect, audi, ferdinand, dies, porsche, aged, cars",Pest and disease outbreaks
101,08/2019,"This fear by association helps it avoid predators, scientists say.

The second flower fly (Eosmallota singularis) was rediscovered in 2017 by researchers from Prof Meier's laboratory during a survey at the Bukit Timah Nature Reserve.

This flower fly is small ",Bicentennial buzz: Sightings of 2 species of flower flies last seen in Singapore 200 years ago,https://www.straitstimes.com/singapore/bicentennial-buzz,"This is only the second time that both species have been seen in Singapore since the 1850s.
But the precious specimens can be seen online, via the freely-accessible Biodiversity of Singapore database compiled by Prof Meier's lab.
A grant from the Ministry of Education (MOE) had enabled this ""virtual repatriation"" of insect species collected by Wallace.
For the project, researchers travelled to British museums housing specimens collected from Singapore during the colonial era and documented them in high-resolution photographs for the database.
Singapore is home to a rich variety of insects, with 334 species of butterflies, 124 species of dragonflies and damselflies, and 130 species of bees, NParks data shows.","scientists, research, singapore, 200, flower, flies, buzz, ago, prof, collected, sightings, database, species, bicentennial, seen, researchers, specimens",Pest and disease outbreaks
