,date,location,news title,news source(url),content summary,keywords,class_name
0,12/2020,"Also, there are two types of insects ","Root Awakening: Wild Cape Gooseberry, Chinese Violet and beetle grubs",https://www.straitstimes.com/life/home-design/root-awakening-16,"Also, there are two types of insects - one white and the other black - growing on my curry leaf plant, leaving small holes on the leaves.
The leaves of the plant have tiny yellow spots and may be infested by spider mites.
Based on the second and third pictures, it appears that your curry leaves are infested with tortoise beetle.
Try to spray such pesticides during the later part of the day to avoid affecting pollinators and other beneficial insects.
Chinese Violet produces edible leaves","edible, leaves, violet, chinese, beetle, grubs, spots, seeds, plant, root, wild, infested, cape, growing, awakening, white, pests, flowers, gooseberry",Pest and disease outbreaks
1,05/2020,"Video game developer Cash Ong spends his days creating mobile entertainment for others.

But in his own time, he finds joy in something a lot more tangible ",Me And My Car: Beetle nut,https://www.straitstimes.com/lifestyle/motoring/beetle-nut,"He had a 1961 Baja Beetle - a version made for offroad use - when he was studying in Australia in the mid-1990s.
Still, Mr Ong loved the way the Beetle could be customised - something which appealed to him as a design student.
After returning to Singapore and starting work as a website developer in 1998, he went about looking for another Beetle.
The car was, Mr Ong describes, a ""girly shade of Xiao Ding Dang blue"", referring to Doraemon, the blue cat in the Japanese cartoon.
The first time was about three years after he bought it - the work included respraying the car purple, a colour Mr Ong deemed cooler than the Doraemon blue.","doraemon, car, xiao, blue, mr, developer, beetle, work, spent, ong, nut",Pest and disease outbreaks
2,07/2019,"PUEBLA, MEXICO (REUTERS) ",Last Volkswagen Beetle drives into the sunset,https://www.straitstimes.com/world/americas/last-volkswagen-beetle-drives-into-the-sunset,"The Puebla factory, which already produces VW's Tiguan SUV, will make the Tarek SUV in place of the Beetle starting in late 2020, Volkswagen de Mexico chief executive Steffen Reiche said.
The current design was the third version of the Beetle after two earlier cancellations and revivals of the marque.
The ""bug"", as the Beetle was nicknamed, debuted in 1938 as an affordable vehicle commissioned by Adolf Hitler to promote car ownership among Germans.
The 1968 movie The Love Bug, which featured a zany anthropomorphic vehicle, stoked Beetle fever.
Despite its place in popular culture, sales of the Beetle have been lacklustre in recent years.","vehicle, volkswagen, drives, car, reiche, suv, sunset, place, beetle, popular, puebla, mexico",Pest and disease outbreaks
3,10/2019,LONDON (AFP) ,UK museum names blind beetle after climate change activist Greta Thunberg,https://www.straitstimes.com/world/europe/uk-museum-names-blind-beetle-after-climate-change-activist-greta-thunberg,"LONDON (AFP) - Britain's Natural History Museum on Friday (Oct 25) named a tiny, blind and wingless beetle after climate activist Greta Thunberg.
The honey-coloured insect, measuring less than one millimetre, was discovered in the Kenyan capital Nairobi in the 1960s.
But it apparently remained nameless until the venerable London museum's scientific associate Michael Darby stepped in.
Sweden's Thunberg, still only 16, has injected a burst of energy into the climate change movement since launching her first school strikes one year ago.
Mr Max Barclay, a senior curator at the 146-year-old museum, said ""the name of this beetle is particularly poignant"".","young, london, blind, history, names, darby, beetle, greta, museum, change, right, work, natural, britains, climate, wingless, thunberg",Pest and disease outbreaks
4,02/2018,PARIS (AFP) ,'Beetlejuice' - it works for real beetles too,https://www.straitstimes.com/world/beetlejuice-it-works-for-real-beetles-too,"The beetles just shake it off and walk away, according to experiments conducted in Japan and chronicled in the British Royal Society journal Biology Letters.
""All 16 beetles that the toads vomited up were still alive and active,"" lead researcher Shinji Sugiura, a professor at Kobe University, told AFP.
More than 600 species of the bombardier beetle famously marry chemical warfare with pinpoint firepower to ward off their enemies.
In the other corner, at a measly 0.2 grammes, was the beetle Pheropsophus jessoensis, along with several other bombardier species of about the same size.
Given the opportunity, all the toads gobbled up the beetles in a now-you-see-it, now-you-don't flash.","toads, bombardier, beetlejuice, works, torrenticola, chemical, beetles, beetle, species, vomit, toxic, toad, real",Pest and disease outbreaks
5,03/2018,TOKYO (AFP) ,Invasive beetle threatens Japan's famed cherry blossoms,https://www.straitstimes.com/asia/east-asia/invasive-beetle-threatens-japans-famed-cherry-blossoms,"TOKYO (AFP) - Across Japan's capital, delicate pink and white cherry blossoms are emerging, but the famed blooms are facing a potentially mortal enemy, experts say: an invasive foreign beetle.
The beetles live inside cherry and plum trees, stripping them of their bark.
Experts say it may have entered in Japan with imported wood materials.
In January, Japan's Environment Ministry officially designated the beetle an invasive alien species, meaning its import and transfer are banned.
He said beetle larva should be killed with pesticide, and trees with serious infestations should be cut down to save others.","serious, blossoms, cherry, invasive, spread, threatens, say, beetle, famed, trees, japans, experts, tokyo",Pest and disease outbreaks
6,11/2017,"A swarm of beetles, carrying tiny computers as backpacks, could one day be crawling through cracks and crevices in search of survivors during rescue missions.

Researchers from Nanyang Technological University (NTU) have developed what they say is the world's smallest cyborg insect, which they can move right and left, backwards and forward, with the click of a button.

Using a species of darkling beetles that measures just 2cm to 2.5cm long and weighs only 0.5g, the team attached a tiny computer of the same weight on the back of each beetle using beeswax.

With a remote control, they can send electrical pulses to the insect's antennae through implanted silver wire electrodes.

The electric pulses mimic those that the insect would feel when its antennae touch an object, which causes the insect to turn on its escape mechanism.

Sending an electric pulse to its right antenna makes it turn left, and vice versa.

At present, two 1.55",Cyborg beetles in search and rescue missions?,https://www.straitstimes.com/singapore/cyborg-beetles-in-search-and-rescue-missions,"A swarm of beetles, carrying tiny computers as backpacks, could one day be crawling through cracks and crevices in search of survivors during rescue missions.
Using a species of darkling beetles that measures just 2cm to 2.5cm long and weighs only 0.5g, the team attached a tiny computer of the same weight on the back of each beetle using beeswax.
The electric pulses mimic those that the insect would feel when its antennae touch an object, which causes the insect to turn on its escape mechanism.
Sending an electric pulse to its right antenna makes it turn left, and vice versa.
At present, two 1.55-volt coin-cell batteries can operate the tiny computer continuously for up to eight hours.","computer, using, left, beetles, cyborg, rescue, pulses, tiny, right, electric, missions, team, insect, search, turn",Pest and disease outbreaks
7,11/2017,SINGAPORE ,"Beetle with tiny computer backpack is world's smallest cyborg insect, say NTU researchers",https://www.straitstimes.com/singapore/beetle-with-tiny-computer-backpack-is-worlds-smallest-cyborg-insect-say-ntu-researchers,"Researchers from Nanyang Technological University (NTU) have developed what they say is the world's smallest cyborg insect, which they can move right and left, backward and forward, with the click of a button.
Using a species of darkling beetles that measures just 2cm to 2.5cm long and weighs only 0.5g, the team attached a tiny computer of the same weight on the back of each beetle using beewax.
The electric pulses mimic those that the insect would feel when its antennae touch an object, which causes the insect to turn on its escape mechanism.
Sending an electric pulse to its right antenna makes it turn left, and vice-versa.
At present, two 1.55-V coin cell batteries can operate the tiny computer continuously for up to eight hours.","turn, computer, using, left, ntu, cyborg, say, beetle, pulses, tiny, smallest, right, electric, team, insect, worlds, researchers",Pest and disease outbreaks
8,01/2018,"NEW YORK • Mort Walker, the creator of Beetle Bailey, a comic strip about a lazy Army private who malingered his way through seven decades at Camp Swampy to the consternation of his commanding officers and the delight of his fans, died last Saturday at his home in Stamford, Connecticut. He was 94.

Walker's death was confirmed by his son Brian.

Walker had the longest tenure of any cartoonist on an original creation, King Features, which began its syndication of Beetle Bailey in 1950, said in a statement.

""Little did I know when I was drafted that I was going to get almost four years of free research,"" Walker recalled in his collection The Best Of Beetle Bailey (1984).

""The army thoughtfully sent me to a number of places, so that my experiences could be broadest,"" he wrote. ""I was a private, a corporal, a sergeant and a lieutenant and I was a goof",Beetle Bailey creator inspired by college fraternity,https://www.straitstimes.com/lifestyle/entertainment/beetle-bailey-creator-inspired-by-college-fraternity,"Walker had the longest tenure of any cartoonist on an original creation, King Features, which began its syndication of Beetle Bailey in 1950, said in a statement.
""Little did I know when I was drafted that I was going to get almost four years of free research,"" Walker recalled in his collection The Best Of Beetle Bailey (1984).
In 1950, amid the Korean War, the signature character syndicated by King Features was Beetle Bailey, in an army uniform.
In the first sketches showing Beetle Bailey in uniform, this time with an Army cap covering his eyes, he took an aptitude test and asked what his speciality would be.
The cast at Camp Swampy also included Sarge's uniformed canine sidekick Otto and Halftrack's sexy secretary Miss Buxley.","university, creator, college, camp, beetle, character, walker, strip, comic, inspired, bailey, army, swampy, fraternity",Pest and disease outbreaks
9,09/2018,NEW YORK (AFP) ,Volkswagen to end iconic 'Beetle' cars in 2019,https://www.straitstimes.com/world/united-states/volkswagen-to-end-iconic-beetle-cars-in-2019,"NEW YORK (AFP) - Volkswagen announced on Thursday (Sept 13) it would end production of its iconic ""Beetle"" cars in 2019 after adding a pair of final editions of the insect-inspired vehicles.
The curvy-topped sedans, which shook off Nazi origins to become a global auto phenomenon, are being sidelined as Volkswagen emphasizes electric cars and larger family-oriented vehicles.
Volkswagen plans to offer the two final edition models in both coupe and convertible styles.
After the war, the Allied countries eventually made Volkswagen a priority in an effort to revive the German auto industry.
The sedans made their US debut in the 1950s, but sales were weak, in part owing to the company's Nazi origins.","volkswagen, sedans, origins, company, iconic, 2019, say, beetle, nazi, plans, end, final, cars, woebcken",Pest and disease outbreaks
10,12/2016,SINGAPORE (THE NEW PAPER) ,NTU's cyborg beetles: Netizens upset over 'animal torture',https://www.straitstimes.com/singapore/ntus-cyborg-beetles-netizens-upset-over-animal-torture,"SINGAPORE (THE NEW PAPER) - A project involving remote-controlled ""cyborg beetles"" by the Nanyang Technological University (NTU) and the University of California, Berkeley has drawn flak, with some netizens crying foul over the perceived insect abuse.
Led by Assistant Professor Hirotaka Sato from the NTU School of Mechanical and Aerospace Engineering, the project was recently featured by US online magazine Motherboard.
In the video, Dr Sato says the project's purpose is to ""control the flight of the beetle"", which will be used for ""peaceful applications"" like finding trapped people using heat signatures.
Each muscle of the beetle is stimulated ""like a robot"".
Dr Sato said: ""It struggles, but it still obeys the signals.""","animal, video, university, dr, upset, flight, torture, cyborg, ntus, beetles, ntu, beetle, sato, project, netizens, control",Pest and disease outbreaks
11,05/2017,"But the couple missed the Beetle so much that they started looking for another soon after, with the hope of passing it to their daughter one day.

""The year was 2008 and we felt we were ready for a second car,"" Madam Lim says. ""It was also only natural that we wanted another Beetle. This time around, we desired a 1950s model or one that looked similar.""

Madam Lim also had a few other criteria. ""Firstly, the car must be of the right look for its age. In other words, it cannot be from the 1950s and have a modern steering wheel, lights and seats,"" she says.

""It must also have the correct registration number. Classic cars cannot have modern numbers.

""Lastly, the overall condition must be good. While I understand that old cars will have some rust, dents and scratches, I don't want to spend a fortune to repair it.""

The couple found a listing on online car portal sgCarMart that matched what they wanted.

""When I saw the advertisement, it stated that the black Beetle was registered in 1971. However, the accompanying photos showed a car which looked like it was from the 1950s,"" Madam Lim says.

""When I called the owner, who is a violinist, I found out that the car had been converted to look like the 1950s model. I made an appointment to take a closer look with my husband and when we saw it, we were pleased with its condition.""

They paid ""a higher price"" than what comparable Beetles commanded then. The car had only one year left on its certificate of entitlement (COE), but ""thankfully, the price to renew the COE was very low then"", Madam Lim says.

Since purchasing the car, the couple have spent about $23,000 on refurbishments such as bodywork, upholstery and having it repainted beige.

The Beetle is driven by Mr Ong daily while Madam Lim ferries Yan Qi and her brother in a Toyota Wish MPV, which they bought new in 2012.

So what does Yan Qi think of the ride that she will inherit one day?

""I like sitting in it because it doesn't have any seat belts, but I wish daddy would turn on the aircon more often as it can get quite hot inside,"" she says.

""Also, I like it when my brother accompanies me because he can enjoy the ride too.""

• The writer contributes to Torque, a motoring monthly published by SPH Magazines",Vintage Volkswagen Beetle for daughter,https://www.straitstimes.com/lifestyle/motoring/present-for-the-future,"But the couple missed the Beetle so much that they started looking for another soon after, with the hope of passing it to their daughter one day.
""The year was 2008 and we felt we were ready for a second car,"" Madam Lim says.
Madam Lim also had a few other criteria.
However, the accompanying photos showed a car which looked like it was from the 1950s,"" Madam Lim says.
The Beetle is driven by Mr Ong daily while Madam Lim ferries Yan Qi and her brother in a Toyota Wish MPV, which they bought new in 2012.","volkswagen, car, daughter, look, yan, couple, saw, beetle, wish, lim, madam, 1950s, vintage",Pest and disease outbreaks
12,08/2018,"Bees and butterflies are praised for their pollination prowess. But millions of years before they ever flirted with a flower, beetles were one of the world's pre","Trapped in 99-million-year-old amber, a beetle with pilfered pollen",https://www.straitstimes.com/world/trapped-in-99-million-year-old-amber-a-beetle-with-pilfered-pollen,"Bees and butterflies are praised for their pollination prowess.
But millions of years before they ever flirted with a flower, beetles were one of the world's pre-eminent pollinators.
Among the plethora of prehistoric plants they helped fertilise were cycads, which look like a mix between palms and ferns, though they are more closely related to pines.
They have thick trunks and pineapple-shaped cones, and they are crowned with feather-like leaves.","amber, pollination, trunks, trapped, prowess, praised, pilfered, pollen, beetle, prehistoric, thick, related, 99millionyearold, pollinatorsamong, worlds, preeminent",Pest and disease outbreaks
13,11/2016,"This is because the females retain their larval form throughout life, explaining their shell",Video footage of rare trilobite beetle in Singapore by local ecologist fascinates the Web,https://www.straitstimes.com/singapore/environment/video-footage-of-rare-trilobite-beetle-in-singapore-by-local-ecologist,"This is because the females retain their larval form throughout life, explaining their shell-like appearance as seen by Mr Wong.
Trilobite beetles, which date from around 47 million years ago, are named after trilobites - armoured sea creatures commonly seen in fossils.
Mr Wong, 26, who has a National Geographic Young Explorer grant, grew up wanting to be like ""entomologist and bug-catching extraordinaire"" Georges Brossard.
He received an undergraduate overseas scholarship from the National Parks Board Singapore in 2011 and graduated from The Australian National University in 2014.
He is currently working as a manager at the National Parks Board, according to his Linkedin profile.","females, singapore, local, rare, trilobite, seen, web, parks, beetles, mr, trilobites, beetle, wong, ecologist, fascinates, national, species, video, footage",Pest and disease outbreaks
14,07/2016,BEIJING (AFP) ,"Beetle named Xi is a pest, say China censors",https://www.straitstimes.com/asia/east-asia/beetle-named-xi-is-a-pest-say-china-censors,"BEIJING (AFP) - Chinese censors have stepped in to crush underfoot talk of a newfound beetle species named after President Xi Jinping, reports said on Tuesday - to the dismay of its loyal discoverer.
""Daddy Xi"", or ""Xi Dada"", is an avuncular nickname for the President that was once pushed in official propaganda but has since been downplayed.
The ""xii"" beetle is not the first new species to be named after a head of state.
Beloved President Xi!
This is a rare beetle!","pest, president, xi, wang, censors, jinping, china, say, beetle, species, rare, named, chinese",Pest and disease outbreaks
15,07/2017,"Spike, a pet beetle about the size of a thumb, has set the Internet abuzz with his natural talent ","Spike, the stag beetle, melting hearts with his drawings",https://www.straitstimes.com/asia/east-asia/spike-the-stag-beetle-melting-hearts-with-his-drawings,"Spike, a pet beetle about the size of a thumb, has set the Internet abuzz with his natural talent - drawing.
Holding a felt-tip marker each time between his strong jaws, the slow-moving stag beetle would create abstract art on his mini canvas with colourful crisp lines.
His owner, a 27-year-old teacher named Mandy Bryant who lives in Japan's Nagano prefecture, described to the BBC that Spike is ""sweet and curious"".
""I hope that people can start to see insects as any other part of the natural world: beautiful and fascinating.
They really aren't as scary as you think,"" Ms Bryant told the BBC.","drawings, world, hearts, stag, spike, beetle, species, bryant, bbc, artwork, natural, canvas, melting",Pest and disease outbreaks
16,09/2016,"Fastest Volkswagen Beetle

A specially tuned Volkswagen Beetle has set a new speed record at the World of Speed in Lake Bonneville in Utah, United States. The Beetle LSR (Land Speed Record) with a turbocharged 2",Fast lane: Fastest Volkswagen Beetle,https://www.straitstimes.com/lifestyle/motoring/fast-lane-fastest-volkswagen-beetle,"Fastest Volkswagen BeetleA specially tuned Volkswagen Beetle has set a new speed record at the World of Speed in Lake Bonneville in Utah, United States.
The Beetle LSR (Land Speed Record) with a turbocharged 2-litre direct- injection engine drove the fastest speed ever documented for a Beetle, reaching 328.195kmh over 1.6km.
It is also the world's fastest diesel SUV, with a century sprint timing of 4.8 seconds and a top speed of 270kmh.
Volkswagen Caddy, Caddy Maxi and Tiguan 2.0 TDI recalledVolkswagen Singapore has started recalling the first registered cars affected by its global diesel scandal.
These are the Caddy, Caddy Maxi and Tiguan 2.0 TDI.","volkswagen, caddy, fast, software, lane, singapore, diesel, fastest, speed, beetle, engine, vehicles, cars",Pest and disease outbreaks
17,07/2016,NEW YORK• Josh Wakely has quickly become one of the busiest young writers and producers in television ,Beetles do Beatles on Netflix,https://www.straitstimes.com/lifestyle/entertainment/beetles-do-beatles-on-netflix,"NEW YORK• Josh Wakely has quickly become one of the busiest young writers and producers in television - with a little help from The Beatles, Bob Dylan and Motown.
Each of his three new shows uses classic pop songs as inspiration, raw material and organising theme.
Beat Bugs, an animated children's series on Netflix based on Beatles songs, begins its first season on Wednesday.
The show features performances of songs such as Lucy In The Sky With Diamonds and Help!
""I realised that these extraordinary melodies would make sense for children, but also the full level of imagination and visual imagery that The Beatles had in their songs,"" he said.","beatles, songs, shows, netflix, beetles, created, dylan, television, way, help, wakely",Pest and disease outbreaks
18,02/2022,"Singapore has at least 25 native dung beetle species, of which at least 23 are tunnellers that belong to this Onthophagus genus.

According to Assistant Professor Nalini Puniamoorthy from the department of biological sciences at NUS, male dung beetles hang out at the entrances of these underground tunnels which are usually dug by females.

Larger males would fight one another for a chance to mate with the female, often using their large horns as a weapon to defend their territory.

The winner gets to mate with the female which lays her eggs in brood balls, which are developmental chambers that she builds out of dung. The male victor continues to defend the female and her brood balls by fighting off other males at the tunnel entrance.

""This is driven by an evolutionary mechanism called sexual selection, where certain traits that increase an individual's reproductive fitness are selected. In this case, horn length and body size are important traits that increase mating success,"" said Prof Nalini.

That being said, many dung beetle species exhibit an interesting alternative mating strategy: the sneaky male tactic.

Small males (with no horns or small horns) can mimic females and sneak past the large guarding males to mate with the female beetles in the tunnel. These male species usually ""compensate"" by having large testes, or more sperm, which in this case, would be a key reproductive trait that influences fertilisation success.

""Different species of dung beetles display vastly different mating behaviours. In some rare instances, the tunnelling can be done by the male beetle, as a nuptial gift almost to say, 'I built a house for you, now you can come and have your offspring',"" she added",Strange love: 4 creatures found in Singapore with unusual mating rituals,https://www.straitstimes.com/singapore/strange-love-4-creatures-found-in-singapore-with-unusual-mating-rituals,"Singapore has at least 25 native dung beetle species, of which at least 23 are tunnellers that belong to this Onthophagus genus.
According to Assistant Professor Nalini Puniamoorthy from the department of biological sciences at NUS, male dung beetles hang out at the entrances of these underground tunnels which are usually dug by females.
That being said, many dung beetle species exhibit an interesting alternative mating strategy: the sneaky male tactic.
These male species usually ""compensate"" by having large testes, or more sperm, which in this case, would be a key reproductive trait that influences fertilisation success.
""Different species of dung beetles display vastly different mating behaviours.","mating, singapore, rituals, female, mate, creatures, males, horns, beetles, male, species, large, love, dung, unusual, strange",Pest and disease outbreaks
