,date,location,news title,news source(url),content summary,keywords,class_name
39,09/2016,"But it lacks the stuff that rings cash registers: princesses, songs, saintly parental figures or goofy sidekicks voiced by comedians ",Animation film driven by passion,https://www.straitstimes.com/lifestyle/entertainment/a-young-boys-courageous-quest,"Instead, Kubo (voiced by Art Parkinson) is a serious child, somewhat worn down by care.
His companions on his quest are a grumpy monkey (voiced by Charlize Theron) and Beetle, an insect-warrior with memory issues.
Beetle is fun, but he is voiced by actor Matthew McConaughey rather than a comedian.
Besides running the company, Knight also paid his dues as an animator on all four Laika features, including Kubo.
Knight knew he was taking a risk that McConaughey might lose his unique power as an actor without the drawl.","mcconaughey, passion, knight, animation, laikas, design, driven, work, voiced, actor, kubo, beetle, films, film",Pest and disease outbreaks
40,08/2016,"Latest Honda Civic 1.6 and 1.5T

Honda's latest Civic looks far more promising than its predecessor, which was introduced here barely four years ago.

The car is available as a sedan, with either a 1.6",Fast Lane: Latest Honda Civic 1.6 and 1.5T,https://www.straitstimes.com/lifestyle/motoring/fast-lane-latest-honda-civic-16-and-15t,"Latest Honda Civic 1.6 and 1.5THonda's latest Civic looks far more promising than its predecessor, which was introduced here barely four years ago.
The car is available as a sedan, with either a 1.6-litre 125bhp normally aspirated or a 1.5-litre 173bhp turbocharged engine.
It has LED headlamps and tail-lamps, 17-inch wheels (16 for the 1.6), and a rear spoiler.
The car is available in coupe and cabriolet forms and, with the new Beetle Dune as the latest addition.
Ford Kuga with more attitudeFord has expanded its ST-Line cars to include the Kuga crossover.","honda, fast, car, lane, 15t, kuga, include, civic, bullet, beetle, cars, available, 16, latest, wheels",Pest and disease outbreaks
41,12/2019,"SCHIERKE, GERMANY (NYTIMES) ",Climate change strikes at the heart of German identity: The woods,https://www.straitstimes.com/world/europe/climate-change-strikes-at-the-heart-of-german-identity-the-woods,"One by one, they grabbed a bundle of the seedlings and picked their way through snow-clad fallen branches, searching for holes that had been dug into the black earth on the edge of the Harz National Park in the heart of Germany.
More than 444,000 acres (179,680ha) of forest in Germany are distressed or have died in recent years, according to government data.
So people are heading into the woods to do what they can do to help save them.
Rangers in the Harz National Park said they had repeatedly sought volunteers to help plant new trees since the park was established in 1990.
""We have a lot of inquiries from people who have a need to do something to help the forest,"" said Mr Eggert, the ranger.","national, heart, strikes, forest, german, identity, mr, help, change, park, roots, trees, woods, climate, volunteers, survival",Pest and disease outbreaks
42,12/2019,"RICH IN HISTORY: Established in 1859, the Singapore Botanic Gardens is the oldest garden in the country, and rich in history. Dr Nigel Taylor (above) stands at two flights of brick steps built by Australian prisoners of war (POWs) during the Japanese occupation. As a sign of defiance, the POWs imprinted arrows on the bricks to indicate that they were detained by the authorities. Six former POWs visited the botanic gardens in 1995 to observe their work.

A TREE THAT CHANGED THE WORLD: Latex from the white gutta tree was popularly used for insulation of undersea communication cables in the late 19th century, paving the way for today's fibre",A final tour of the Botanic Gardens,https://www.straitstimes.com/singapore/a-final-tour-of-the-gardens,"RICH IN HISTORY: Established in 1859, the Singapore Botanic Gardens is the oldest garden in the country, and rich in history.
Six former POWs visited the botanic gardens in 1995 to observe their work.
This tree is one of two that remain from a plantation installed by former Botanic Gardens director H.N.
THRIVING NUTMEG: Nutmeg was a major spice crop in Singapore in the 1840s before disease destroyed plantations in the 1860s.
NEW LIFE FOR TEMBUSU TREE: Known as the tree on Singapore's $5 note, this 30m-tall tembusu is probably over 150 years old.","thrive, bamboo, pows, botanic, tour, nutmeg, soil, taylor, tembusu, tree, final, gardens",Pest and disease outbreaks
43,11/2021,"TEREMISKI, POLAND (AFP) ",Poland's 'priceless' primeval forest pits environmentalists against state,https://www.straitstimes.com/world/europe/polands-priceless-primeval-forest-pits-environmentalists-against-state,"TEREMISKI, POLAND (AFP) - Stopping by a giant oak tree in Europe's largest surviving primeval forest, environmental journalist Adam Wajrak pauses in admiration.
""The trees here were born when the United States did not exist yet, when electricity had not been invented,"" said the journalist, who moved to a village in the vast Bialowieza forest 25 years ago.
The forest, which is divided by the Poland-Belarus border, is a treasure of biodiversity and a giant carbon sink.
The Bialowieza forest covers an area of 1,500 sq km and is dissected by the border between Belarus and Poland.
Carbon reservoirStrolling deep in the forest, Wajrak stopped to pull some hairs caught on a tree trunk.","village, poland, polands, point, forest, primeval, environmentalists, giant, bialowieza, pits, wajrak, tree, protect, priceless, state",Pest and disease outbreaks
44,09/2019,"Spikemoss needs a moist, shaded environment to thrive

My bed of ferns used to be bushy. But now, there are only sporadic patches of ferns that are still alive. The bare ground is an area of exposed soil, moss and some weeds. What kind of ferns are these? How should I care for them?

Shirley Tham

The plant is better known as a fern ally and is a species of Selaginella most commonly called a spikemoss or clubmoss. Common names can be confusing. Also, note that it is neither a moss nor a fern.

The soil looks compacted. This plant has to be grown in a well","Root Awakening: Spikemoss needs a moist, shaded environment to thrive",https://www.straitstimes.com/lifestyle/home-design/root-awakening-spikemoss-needs-a-moist-shaded-environment-to-thrive,"Spikemoss needs a moist, shaded environment to thriveMy bed of ferns used to be bushy.
This plant has to be grown in a well-drained media that is rich in organic matter and moisture-retentive to thrive.
You can check out the book, 1001 Garden Plants In Singapore, published by the National Parks Board at the library.
Wingpod Purslane is different from Common PurslaneIs this plant the Common Purslane?
The Common Purslane that is often grown for its edible leaves and young shoots is a relative.","pesticide, national, thrive, singapore, plants, shaded, needs, environment, spikemoss, awakening, common, soil, leaves, moist, grown, plant, root, purslane",Pest and disease outbreaks
45,07/2019,"Bentley concept with a range of 700km

The EXP 100GT is the sexiest Bentley concept yet. Unveiled to mark the brand's centenary, it is a sports car which is electric and autonomous.

The 100GT is said to have a range of 700km ",Fast Lane: Bentley concept with a range of 700km,https://www.straitstimes.com/lifestyle/motoring/fast-lane-bentley-concept-with-a-range-of-700km,"Bentley concept with a range of 700kmThe EXP 100GT is the sexiest Bentley concept yet.
The 100GT is said to have a range of 700km - more than what any combustion engined supercar can attain today.
Bentley says the autonomous car ""can be driven when one wishes to enjoy the thrill of driving"".
Only 500 units of Renault Megane RS Trophy-RThe new Renault Megane RS Trophy-R is 130kg lighter than the Megane RS Trophy.
Lexus unveils LC ConvertibleLexus will extend its LC range with an open-top.","range, volkswagen, bentley, units, fast, car, lane, record, rs, speed, lc, electric, concept, 700km, seconds",Pest and disease outbreaks
46,11/2018,LONDON (THOMSON REUTERS FOUNDATION) ,"More heatwaves, fewer babies? Climate change may zap male fertility, scientists find",https://www.straitstimes.com/world/europe/more-heatwaves-fewer-babies-climate-change-may-zap-male-fertility-scientists-find,"LONDON (THOMSON REUTERS FOUNDATION) - Would-be fathers have long been advised to wear boxer shorts and avoid hot tubs, to avoid too much heat damaging their reproductive chances.
They found that male red flour beetles exposed to a heatwave in the lab had half the expected number of offspring, and that exposure to a second heatwave, 10 days later, virtually sterilised the males.
Male flour beetles sired by heat-damaged fathers also lived shorter lives themselves and had much less success reproducing, said Matt Gage, a biologist at the University of East Anglia and head of the research team.
""We've known for hundreds of years that male fertility is sensitive to heat,"" Gage told the Thomson Reuters Foundation.
But, in particular, ""the trans-generational effect was very surprising"" in the new research, he said.","scientists, research, gage, fertility, thomson, heatwave, beetles, fewer, male, zap, heat, fathers, change, babies, flour, effect, climate, heatwaves",Pest and disease outbreaks
47,11/2018,LONDON • Would,Climate change may affect male fertility: Study,https://www.straitstimes.com/world/europe/climate-change-may-affect-male-fertility-study,"Now it turns out the same effect - but caused by stronger heatwaves driven by climate change - may be behind huge declines in insect numbers, scientists said, in a study published on Tuesday in the journal Nature Communications.
Male flour beetles sired by heat-damaged fathers also lived shorter lives themselves and had much less success reproducing, said Professor Matt Gage, a biologist at the University of East Anglia and head of the research team.
""We've known for hundreds of years that male fertility is sensitive to heat,"" Prof Gage told the Thomson Reuters Foundation.
A 2017 study published in Science magazine found that flying insect populations in German nature reserves had plunged more than 75 per cent over about 30 years.
Prof Gage's team believes that may be linked to an increasing number of heatwaves over those decades - a concern for the planet's biodiversity and potentially for would-be parents - as climate change brings hotter, longer heatwaves.","research, study, wouldbe, fertility, published, prof, male, affect, change, flour, number, potentially, climate, heatwaves",Pest and disease outbreaks
48,07/2018,"Seat's fastest electric car

Seat has made its fastest electric car. The 680hp battery",Fast Lane: Seat's fastest electric car,https://www.straitstimes.com/lifestyle/fast-lane-seats-fastest-electric-car,"Seat's fastest electric carSeat has made its fastest electric car.
The Cupra e-Racer complies with new regulations of the E TCR series - the first electric, multi-brand touring car championship.
In addition to its generous space, Audi's first electric car offers a Bang & Olufsen 3D Premium Sound System.
GT-R prototype from Nissan and ItaldesignNissan and Italdesign have created a new prototype vehicle - the Nissan GT-R50 - in their first collaboration.
Nostalgic Beetle Dune arrivesVolkswagen Centre Singapore has brought in the Beetle Dune - a car which pays homage to the dune buggies of the 1960s.","centre, fast, car, lane, dune, crossover, fastest, seats, prototype, electric, mclaren, system, seconds, nissan",Pest and disease outbreaks
49,08/2021,TOKYO ,Alleged acid attacker on Tokyo subway was angry over victim's 'casual language',https://www.straitstimes.com/asia/east-asia/alleged-acid-attacker-on-tokyo-subway-was-angry-over-victims-casual-language,"TOKYO - The use of informal language by a university junior so upset Hirotaka Hanamori that he bore a years-long grudge that led to an acid attack at a Tokyo subway station last week.
Mr Hanamori, 25, was nabbed on Aug 28 in Okinawa, four days after the attack at about 9.05pm at the Shirokane-Takanawa station in Tokyo.
Mr Hanamori, who was on Monday (Aug 30) referred to prosecutors but has not been charged, allegedly flung sulphuric acid at his victim.
Violent crime is relatively rare in Japan, though this was the second attack on Tokyo's train network this month.
They came despite a heightened security alert for the Tokyo 2020 Olympic and Paralympic Games.","victims, angry, attack, tsushima, casual, hanamori, wanted, train, attacker, subway, alleged, wrong, station, language, paralympic, acid, tokyo",Pest and disease outbreaks
50,02/2018,"Japanese bamboo, money plant thrive with several hours of filtered light

May I know the name of the plant (above)? How should I take care of it? Also, is this other plant the neon pothos (above right)? Should I care for it the same as other pothos?

Lim Tsz Kwan

The plant (photo 1) is a type of Japanese bamboo. It is botanically known as Dracaena surculosa and hence not a true bamboo.

There are two other more attractive cultivars, namely, Florida Beauty and Milky Way, which feature more vivid variegation and splashes of white on their leaves.

The plant (photo 2) is a type of money plant ",Root Awakening,https://www.straitstimes.com/lifestyle/home-design/root-awakening-41,"The plant (photo 2) is a type of money plant - it is known botanically as Epipremnum aureum and the cultivar name is Gold.
Soil should be well-drained and kept moist at all times.
White tortoise beetles attacking curry treeI have a curry tree (Murraya koenigii) that has been recently infested with this insect.
Jackie TanIt seems that your curry tree (Bergera koenigii) has been attacked by adult white tortoise beetles.
There are no organic pesticides that are locally available that are effective against the white tortoise beetle.","white, safe, light, plants, straits, known, leaves, grow, tortoise, plant, orchid, times",Pest and disease outbreaks
51,01/2018,Limited,Fast Lane,https://www.straitstimes.com/lifestyle/motoring/fast-lane-37,"Limited-edition McLaren MSO X mirrors GT4 race carMcLaren has delivered 10 MSO X cars - street-legal versions of its 570S GT4 race car.
Designed to mirror the external appearance of the McLaren 570S GT4 race car as closely as possible, the MSO X cars are deliberately finished in accordance with race car design practice and all have liveries inspired by McLaren F1 GTR endurance race cars of the mid-1990s.
Land Rover makes coupeLand Rover will make a limited-edition Range Rover SV Coupe - no more than 999 units will be produced - to mark its 70th anniversary.
The brand will spend €1.8 billion (S$2.9 billion) developing the new hatch.
BMW and Daimler close to merging car-sharing unitsBMW and Daimler are close to merging their car-sharing units, reported Reuters.","reported, units, volkswagen, billion, car, straits, buzz, race, x, rover, cars, times",Pest and disease outbreaks
52,12/2017,SHANGHAI (AFP) ,He gave up a successful business to run ancient Silk Road from Hamburg to Shanghai,https://www.straitstimes.com/asia/east-asia/this-man-gave-up-a-successful-business-to-run-ancient-silk-road-from-hamburg-to,"Troubled by what he sees as growing bigotry and division in the world, the German management consultant gave up a successful business to run the ancient Silk Road from Hamburg to Shanghai in a Quixotic quest to show that we are all one.
But Markus, whose wife is Chinese, could find no one who had run the route from sea to sea.
""Why not connect Europe and China along the Silk Road, which is in all people's minds at the moment?""
Then, in late September, a freak stumble while running in China's central Hubei province broke both of Markus' heel bones.
""But that's not my style, and Victor, that's also not his style,"" said Markus, who spends most of his time in a recovery wheelchair.","run, successful, world, thats, shanghai, road, business, gave, china, running, markus, hamburg, ancient, style, silk, chinese, victor",Pest and disease outbreaks
53,11/2017,This stop,Time to trade in COE scheme for a newer model?,https://www.straitstimes.com/singapore/transport/time-to-trade-in-coe-scheme-for-a-newer-model,"The COE scheme was introduced years later, after I had left the service.
Some of these changes will severely disrupt traditional taxi services and the livelihood of taxi drivers.
The COE scheme was an old-world solution in the pre-digital age, even before Electronic Road Pricing was introduced.
It will require the same can-do spirit of the COE days to put Singapore at the forefront again in solving its urban transport problems.
Time to trade in the COE scheme for a newer model?","technology, taxi, roads, trade, coe, model, scheme, newer, services, solution, number, cars, think",Pest and disease outbreaks
54,11/2017,"Businessman Lee Boon Teow told the High Court that he gave the money to Venerable Guojun to pursue a doctoral degree, but the former abbot of Mahabodhi Monastery instead used part of it to buy property in Australia.

READ MORE HERE

Bishan MRT tunnel flooding: Legal action SMRT can take against ex","Top stories from The Straits Times on Wednesday, Nov 29",https://www.straitstimes.com/singapore/top-stories-from-the-straits-times-on-wednesday-nov-29,"Businessman Lee Boon Teow told the High Court that he gave the money to Venerable Guojun to pursue a doctoral degree, but the former abbot of Mahabodhi Monastery instead used part of it to buy property in Australia.
READ MORE HEREBishan MRT tunnel flooding: Legal action SMRT can take against ex-staff depends on contract terms","property, pursue, straits, nov, 29, smrt, teow, used, mrt, tunnel, told, terms, times, venerable",Pest and disease outbreaks
55,05/2017,"TOP OF THE NEWS

US 'committed to Asean'

The United States underscored its commitment to Asean at a meeting of foreign ministers by pledging to ""build a way forward and grow the economic relationship"". Secretary of State Rex Tillerson also told the ministers the US was committed to upholding freedom of navigation in the South China Sea.

WORLD

East Asia powers pledge unity

East Asia's three biggest economies vowed yesterday to work together to help prevent market instability as tensions run high over Pyongyang's weapons programmes. Finance ministers and central bank governors from China, Japan and South Korea affirmed their cooperation in the face of future uncertainty, a joint statement said.

WORLD

Local poll win a boost for May

Britain's ruling Conservative Party made strong gains in local elections yesterday, suggesting that Prime Minister Theresa May's Brexit strategy is winning over voters who may give her an easy victory in the parliamentary polls on June 8. The biggest loser was the anti","What's News: May 06, 2017",https://www.straitstimes.com/world/whats-news-may-06-2017,"Secretary of State Rex Tillerson also told the ministers the US was committed to upholding freedom of navigation in the South China Sea.
Finance ministers and central bank governors from China, Japan and South Korea affirmed their cooperation in the face of future uncertainty, a joint statement said.
HOMEArts education in pre-schoolNTUC's My First Skool and the National Arts Council have created an arts education programme, piloted at its pre-school in Edgefield Plains in Punggol.
HOMEAll about Yusof IshakSingapore's first president loved reading P.G.Wodehouse, and listened to Beethoven as much as he did Malay ballads.
These details of Mr Yusof Ishak's life are in a coffee table book launched yesterday by ISEAS - Yusof Ishak Institute deputy director Ooi Kee Beng.","south, whats, 06, singapore, world, education, committed, 2017, yusof, arts, yesterday, ministers, programme",Pest and disease outbreaks
56,04/2017,FRANKFURT (BLOOMBERG) ,VW's owner clan sells Porsche design stake ahead of Piech exit,https://www.straitstimes.com/business/vws-owner-clan-sells-porsche-design-stake-ahead-of-piech-exit,"Porsche, the Volkswagen brand that manufactures the 911 sports car, bought the family's 35 per cent stake in Porsche Design, the company said in a statement on Wednesday.
The maker of upscale sunglasses, watches and other merchandise is now a wholly owned subsidiary of the Porsche car brand.
Mr Piech will sell nearly all of his 14.7 per cent holding of the voting shares of Porsche Automobil Holding.
Porsche Design was founded in 1972 by Ferdinand Alexander Porsche, a grandson of the Beetle's creator and the designer of the original 911 sports car.
""The fundamental strategy of the Porsche Design Group is unaffected by the buy-out,"" Porsche's chief financial officer Lutz Meschke said.","piech, exit, volkswagen, vw, stake, car, vehicle, holding, company, sells, clan, design, cent, vws, owner, shares, porsche, ahead",Pest and disease outbreaks
57,12/2016,"Larger specimens of Green Aralia bloom more often

I saw this plant (pictured), which had a blooming cluster of flowers, along a boardwalk in Changi.

What is it known as and does it bloom often?

Linda Giam

The plant is botanically known as Osmoxylon lineare. It is also commonly known as Green Aralia and Miagos Bush.

Larger and more mature specimens are known to flower more often. When grown as a hedge for landscaping, the plant is frequently pruned to the desired height and shape. As a result, the flowers of this plant may not be seen that often here.

In Singapore, there is another variety that has variegated leaves, which are golden yellow when grown in full sun.

Tip: Make necklaces from fruit of Job's Tears

The Job's Tears plant is a member of the Grass family (Poaceae). It is also called Coixseed or botanically known as Coix lacryma",Root Awakening: Larger specimens of Green Aralia bloom more often,https://www.straitstimes.com/lifestyle/home-design/root-awakening-larger-specimens-of-green-aralia-bloom-more-often,"Larger specimens of Green Aralia bloom more oftenI saw this plant (pictured), which had a blooming cluster of flowers, along a boardwalk in Changi.
It is also commonly known as Green Aralia and Miagos Bush.
Larger and more mature specimens are known to flower more often.
Tip: Make necklaces from fruit of Job's TearsThe Job's Tears plant is a member of the Grass family (Poaceae).
Keep Queen of the Night from the rainHow do I get rid of these pests growing on the leaf?","pests, night, specimens, larger, queen, bloom, aralia, scabs, mature, known, jobs, awakening, green, grown, plant, root",Pest and disease outbreaks
58,10/2016,"Then he took the car back to the groomer and showed him how the swirl marks were removed.

""He even wanted to hire me to show his staff how car grooming should be done.""

A year later, Mr Loke upgraded to a Makita car polisher used by professional groomers and even bought a $900 device to measure the thickness of paints. Polishing takes away a certain layer of paint, he explains, and the device tells him how much paint thickness remains on the car.

His interest took a serious turn around 2005, when friends started asking him to groom their cars. They pay him between $80 and $350 for his time and materials.

""It is like giving tuition, about $50 an hour,"" he says in jest.

The most obsessive thing he did was to track down the sole distributor of a cleaning solution that is used to clean aircraft seats and outdoor awnings, which he uses to clean the interior of cars.

""The supplier was surprised that I bought in small amounts because he mostly supplies companies,"" says Mr Loke.

He even considered renting or buying a terrace house and using the porch to groom cars for a living.

""I decided not to do so in the end because I have a stable job and there are financial risks,"" he says.

He still grooms cars for friends on weekends when he is free.

""The period before Chinese New Year is the busiest. Those who cannot get appointments with car groomers will ask me for help,"" he says.

""I have even trained about 10 of my friends' maids on the proper way of washing a car after it is polished,"" he says.

Big cars such as the Toyota Alphard and Honda Estima are the hardest to groom, he adds, with each session taking up to eight hours. ""I have to start in the morning, go for lunch and return to finish the job in the afternoon.""

The hardest car to polish is the new Volkswagen Beetle, he says. ""The car's surfaces are all round ",Grooming obsession,https://www.straitstimes.com/lifestyle/motoring/grooming-obsession,"""He even wanted to hire me to show his staff how car grooming should be done.""
His interest took a serious turn around 2005, when friends started asking him to groom their cars.
He even considered renting or buying a terrace house and using the porch to groom cars for a living.
His interest in car grooming has rubbed off on his nine-year-old daughter Kayen, who helps him wash his Peugeot on weekends.
""The paint of white cars can turn yellowish, this car is still white.""","white, paint, car, obsession, friends, mr, groom, bought, used, grooming, cars, turn",Pest and disease outbreaks
